{
  "$schema": "https://json-schema.org/draft/2020-12/schema",
  "$id": "https://schemas.kurobara.invalid/schemas/plays/command-response/1.0.0",
  "title": "PlayCommandResponse",
  "description": "Compiled Play preview or immutable Play revision and durable run receipt.",
  "type": "object",
  "additionalProperties": false,
  "required": ["action"],
  "properties": {
    "action": {
      "type": "string",
      "enum": ["preview", "approve", "start", "pause", "retire"]
    },
    "compilation": { "$ref": "#/$defs/compilation" },
    "fingerprint": {
      "type": "string",
      "pattern": "^sha256:[0-9a-f]{64}$"
    },
    "issues": {
      "type": "array",
      "maxItems": 256,
      "items": {
        "$ref": "https://schemas.kurobara.invalid/schemas/gtm/context-command-response/1.0.0#/$defs/issue"
      }
    },
    "lifecycle": {
      "type": "string",
      "enum": [
        "draft",
        "validated",
        "previewed",
        "awaiting_approval",
        "approved",
        "active",
        "paused",
        "retired"
      ]
    },
    "play": {
      "$ref": "https://schemas.kurobara.invalid/schemas/plays/command-request/1.0.0#/$defs/play"
    },
    "requires_human_approval": { "type": "boolean" },
    "revision": { "$ref": "#/$defs/revision" },
    "run": { "$ref": "#/$defs/run" }
  },
  "oneOf": [
    {
      "type": "object",
      "required": [
        "action",
        "compilation",
        "fingerprint",
        "issues",
        "lifecycle",
        "play",
        "requires_human_approval"
      ],
      "properties": {
        "action": { "const": "preview" },
        "revision": false,
        "run": false
      }
    },
    {
      "type": "object",
      "required": ["action", "revision"],
      "properties": {
        "action": { "enum": ["approve", "pause", "retire"] },
        "compilation": false,
        "fingerprint": false,
        "issues": false,
        "lifecycle": false,
        "play": false,
        "requires_human_approval": false,
        "run": false
      }
    },
    {
      "type": "object",
      "required": ["action", "revision", "run"],
      "properties": {
        "action": { "const": "start" },
        "compilation": false,
        "fingerprint": false,
        "issues": false,
        "lifecycle": false,
        "play": false,
        "requires_human_approval": false
      }
    }
  ],
  "$defs": {
    "compilation": {
      "type": "object",
      "additionalProperties": false,
      "required": [
        "assumptions",
        "authority",
        "budget",
        "deadline_ms",
        "export_mode",
        "intention_hash",
        "stages"
      ],
      "properties": {
        "assumptions": {
          "type": "array",
          "maxItems": 64,
          "items": {
            "type": "string",
            "minLength": 1,
            "maxLength": 2048,
            "pattern": "\\S"
          }
        },
        "authority": {
          "type": "object",
          "additionalProperties": false,
          "required": ["human_gates", "permissions"],
          "properties": {
            "human_gates": {
              "type": "array",
              "maxItems": 32,
              "uniqueItems": true,
              "items": {
                "type": "string",
                "minLength": 1,
                "maxLength": 255,
                "pattern": "^[a-z][a-z0-9_:-]*$"
              }
            },
            "permissions": {
              "type": "array",
              "maxItems": 64,
              "uniqueItems": true,
              "items": {
                "type": "string",
                "minLength": 1,
                "maxLength": 255,
                "pattern": "^[a-z][a-z0-9-]*:[a-z][a-z0-9-]*$"
              }
            }
          }
        },
        "budget": {
          "type": "object",
          "additionalProperties": false,
          "required": ["limit", "quoted_upper_bound", "unit"],
          "properties": {
            "limit": {
              "type": "number",
              "exclusiveMinimum": 0,
              "maximum": 1000000000000000
            },
            "quoted_upper_bound": {
              "type": "number",
              "minimum": 0,
              "maximum": 1000000000000000
            },
            "unit": {
              "type": "string",
              "minLength": 1,
              "maxLength": 64,
              "pattern": "^[a-z][a-z0-9._-]*$"
            }
          }
        },
        "deadline_ms": {
          "type": "integer",
          "minimum": 0,
          "maximum": 9007199254740991
        },
        "export_mode": { "type": "string", "const": "no_send" },
        "intention_hash": {
          "type": "string",
          "pattern": "^sha256:[0-9a-f]{64}$"
        },
        "stages": {
          "type": "array",
          "minItems": 1,
          "maxItems": 128,
          "items": {
            "type": "object",
            "additionalProperties": false,
            "required": ["input_fingerprint", "operation_id", "ordinal"],
            "properties": {
              "capability": {
                "type": "string",
                "minLength": 1,
                "maxLength": 255,
                "pattern": "^[a-z][a-z0-9.-]*$"
              },
              "input_fingerprint": {
                "type": "string",
                "pattern": "^sha256:[0-9a-f]{64}$"
              },
              "operation_id": {
                "type": "string",
                "minLength": 1,
                "maxLength": 255,
                "pattern": "^[a-z][a-z0-9-]*(\\.[a-z][a-z0-9-]*)+$"
              },
              "ordinal": {
                "type": "integer",
                "minimum": 1,
                "maximum": 128
              }
            }
          }
        }
      }
    },
    "revision": {
      "type": "object",
      "additionalProperties": false,
      "required": [
        "compilation",
        "created_at_ms",
        "created_by_actor_id",
        "fingerprint",
        "lifecycle",
        "play",
        "play_id",
        "revision",
        "workspace_id"
      ],
      "properties": {
        "compilation": { "$ref": "#/$defs/compilation" },
        "created_at_ms": {
          "type": "integer",
          "minimum": 0,
          "maximum": 9007199254740991
        },
        "created_by_actor_id": {
          "type": "string",
          "minLength": 1,
          "maxLength": 255,
          "pattern": "\\S"
        },
        "fingerprint": {
          "type": "string",
          "pattern": "^sha256:[0-9a-f]{64}$"
        },
        "lifecycle": {
          "type": "string",
          "enum": [
            "draft",
            "validated",
            "previewed",
            "awaiting_approval",
            "approved",
            "active",
            "paused",
            "retired"
          ]
        },
        "play": {
          "$ref": "https://schemas.kurobara.invalid/schemas/plays/command-request/1.0.0#/$defs/play"
        },
        "play_id": {
          "type": "string",
          "minLength": 1,
          "maxLength": 255,
          "pattern": "^[A-Za-z0-9][A-Za-z0-9._:-]*$"
        },
        "revision": {
          "type": "integer",
          "minimum": 1,
          "maximum": 2147483647
        },
        "workspace_id": {
          "type": "string",
          "minLength": 1,
          "maxLength": 255,
          "pattern": "\\S"
        }
      }
    },
    "run": {
      "type": "object",
      "additionalProperties": false,
      "required": [
        "compilation",
        "created_at_ms",
        "execution",
        "idempotency_key",
        "play",
        "play_id",
        "play_revision",
        "revision",
        "run_id",
        "state",
        "updated_at_ms",
        "workspace_id"
      ],
      "properties": {
        "compilation": { "$ref": "#/$defs/compilation" },
        "created_at_ms": {
          "type": "integer",
          "minimum": 0,
          "maximum": 9007199254740991
        },
        "execution": { "$ref": "#/$defs/run_execution" },
        "idempotency_key": {
          "type": "string",
          "minLength": 1,
          "maxLength": 255,
          "pattern": "^[A-Za-z0-9][A-Za-z0-9._:-]*$"
        },
        "play": {
          "$ref": "https://schemas.kurobara.invalid/schemas/plays/command-request/1.0.0#/$defs/play"
        },
        "play_id": {
          "type": "string",
          "minLength": 1,
          "maxLength": 255,
          "pattern": "^[A-Za-z0-9][A-Za-z0-9._:-]*$"
        },
        "play_revision": {
          "type": "integer",
          "minimum": 1,
          "maximum": 2147483647
        },
        "revision": {
          "type": "integer",
          "minimum": 1,
          "maximum": 2147483647
        },
        "run_id": {
          "type": "string",
          "minLength": 1,
          "maxLength": 255,
          "pattern": "^[A-Za-z0-9][A-Za-z0-9._:-]*$"
        },
        "state": {
          "type": "string",
          "enum": [
            "queued",
            "running",
            "paused",
            "completed",
            "failed",
            "cancelled"
          ]
        },
        "updated_at_ms": {
          "type": "integer",
          "minimum": 0,
          "maximum": 9007199254740991
        },
        "workspace_id": {
          "type": "string",
          "minLength": 1,
          "maxLength": 255,
          "pattern": "\\S"
        }
      }
    },
    "run_cost": {
      "type": "object",
      "additionalProperties": false,
      "required": ["reserved", "spent", "unit"],
      "properties": {
        "reserved": {
          "type": "number",
          "minimum": 0,
          "maximum": 1000000000000000
        },
        "spent": {
          "type": "number",
          "minimum": 0,
          "maximum": 1000000000000000
        },
        "unit": {
          "type": "string",
          "minLength": 1,
          "maxLength": 64,
          "pattern": "^[a-z][a-z0-9._-]*$"
        }
      }
    },
    "run_execution": {
      "type": "object",
      "additionalProperties": false,
      "required": [
        "cost",
        "provider_calls",
        "provenance",
        "selected_record_ids",
        "selection_reasons",
        "stages"
      ],
      "properties": {
        "cost": { "$ref": "#/$defs/run_cost" },
        "current_stage_ordinal": {
          "type": "integer",
          "minimum": 1,
          "maximum": 128
        },
        "error": {
          "type": "object",
          "additionalProperties": false,
          "required": ["code", "message", "retryable"],
          "properties": {
            "code": {
              "type": "string",
              "minLength": 1,
              "maxLength": 128,
              "pattern": "^[a-z][a-z0-9-]*$"
            },
            "message": {
              "type": "string",
              "minLength": 1,
              "maxLength": 2048,
              "pattern": "\\S"
            },
            "retryable": { "type": "boolean" }
          }
        },
        "provider_calls": {
          "type": "integer",
          "minimum": 0,
          "maximum": 1000
        },
        "provenance": {
          "type": "array",
          "maxItems": 256,
          "items": {
            "type": "string",
            "minLength": 1,
            "maxLength": 255,
            "pattern": "\\S"
          }
        },
        "result": {
          "type": "object",
          "additionalProperties": false,
          "required": [
            "dataset_id",
            "export_ready",
            "materialization_id",
            "record_count",
            "workbook_id"
          ],
          "properties": {
            "dataset_id": {
              "type": "string",
              "minLength": 1,
              "maxLength": 255,
              "pattern": "^[A-Za-z0-9][A-Za-z0-9._:-]*$"
            },
            "export_ready": { "type": "boolean" },
            "materialization_id": {
              "type": "string",
              "minLength": 1,
              "maxLength": 255,
              "pattern": "^[A-Za-z0-9][A-Za-z0-9._:-]*$"
            },
            "record_count": {
              "type": "integer",
              "minimum": 0,
              "maximum": 2147483647
            },
            "workbook_id": {
              "type": "string",
              "minLength": 1,
              "maxLength": 255,
              "pattern": "^[A-Za-z0-9][A-Za-z0-9._:-]*$"
            }
          }
        },
        "selected_record_ids": {
          "type": "array",
          "maxItems": 1000,
          "uniqueItems": true,
          "items": {
            "type": "string",
            "minLength": 1,
            "maxLength": 255,
            "pattern": "^[A-Za-z0-9][A-Za-z0-9._:-]*$"
          }
        },
        "selection_reasons": {
          "type": "array",
          "maxItems": 1000,
          "items": {
            "type": "object",
            "additionalProperties": false,
            "required": ["reasons", "record_id"],
            "properties": {
              "reasons": {
                "type": "array",
                "maxItems": 32,
                "uniqueItems": true,
                "items": {
                  "type": "string",
                  "minLength": 1,
                  "maxLength": 255,
                  "pattern": "\\S"
                }
              },
              "record_id": {
                "type": "string",
                "minLength": 1,
                "maxLength": 255,
                "pattern": "^[A-Za-z0-9][A-Za-z0-9._:-]*$"
              }
            }
          }
        },
        "stages": {
          "type": "array",
          "minItems": 1,
          "maxItems": 128,
          "items": {
            "type": "object",
            "additionalProperties": false,
            "required": [
              "cost",
              "operation_id",
              "ordinal",
              "provider_calls",
              "state"
            ],
            "properties": {
              "cost": { "$ref": "#/$defs/run_cost" },
              "dataset_id": {
                "type": "string",
                "minLength": 1,
                "maxLength": 255,
                "pattern": "^[A-Za-z0-9][A-Za-z0-9._:-]*$"
              },
              "generation_id": {
                "type": "string",
                "minLength": 1,
                "maxLength": 255,
                "pattern": "^[A-Za-z0-9][A-Za-z0-9._:-]*$"
              },
              "materialization_id": {
                "type": "string",
                "minLength": 1,
                "maxLength": 255,
                "pattern": "^[A-Za-z0-9][A-Za-z0-9._:-]*$"
              },
              "operation_id": {
                "type": "string",
                "minLength": 1,
                "maxLength": 255,
                "pattern": "^[a-z][a-z0-9-]*(\\.[a-z][a-z0-9-]*)+$"
              },
              "ordinal": {
                "type": "integer",
                "minimum": 1,
                "maximum": 128
              },
              "provider_calls": {
                "type": "integer",
                "minimum": 0,
                "maximum": 1000
              },
              "record_count": {
                "type": "integer",
                "minimum": 0,
                "maximum": 2147483647
              },
              "state": {
                "type": "string",
                "enum": ["pending", "running", "completed", "failed"]
              }
            }
          }
        }
      }
    }
  },
  "x-kurobara-schema-version": "1.0.0",
  "x-kurobara-owner": "application.gtm",
  "x-kurobara-data-classification": "confidential",
  "x-kurobara-redaction": "no-secrets-provider-neutral",
  "x-kurobara-publication-status": "local-development-only"
}
